{
  "assessment_id": "va-<UUID>",
  "assessment_status": {
    "completed_at": "<TIMESTAMP>",
    "domains_attempted": [
      "scanner",
      "acquisition",
      "bids"
    ],
    "domains_completed": [
      "scanner",
      "acquisition",
      "bids"
    ],
    "errors": [],
    "started_at": "<TIMESTAMP>",
    "state": "completed_with_unknowns",
    "warnings": []
  },
  "criteria": [
    {
      "criterion_id": "VECTA-DWI-001",
      "criterion_version": "0.1.0",
      "evaluated_at": "<TIMESTAMP>",
      "evaluation_engine_version": "0.1.0",
      "finding_refs": [
        "finding-0001"
      ],
      "input_snapshot": {
        "VECTA.DWI.ACQ.PE_DIRECTION": {
          "state": "unknown",
          "value": null
        }
      },
      "profile_id": "dwi_connectomics",
      "status": "finding"
    },
    {
      "criterion_id": "VECTA-DWI-014",
      "criterion_version": "0.1.0",
      "evaluated_at": "<TIMESTAMP>",
      "evaluation_engine_version": "0.1.0",
      "finding_refs": [],
      "input_snapshot": {
        "VECTA.DWI.ACQ.REVERSE_PE_AVAILABLE": {
          "state": "unknown",
          "value": null
        }
      },
      "profile_id": "dwi_connectomics",
      "status": "unknown"
    },
    {
      "criterion_id": "VECTA-DWI-021",
      "criterion_version": "0.1.0",
      "evaluated_at": "<TIMESTAMP>",
      "evaluation_engine_version": "0.1.0",
      "finding_refs": [
        "finding-0002"
      ],
      "input_snapshot": {
        "VECTA.DWI.ACQ.PE_DIRECTION": {
          "state": "unknown",
          "value": null
        },
        "VECTA.DWI.ACQ.TOTAL_READOUT_TIME_PRESENT": {
          "state": "observed",
          "value": false
        }
      },
      "profile_id": "dwi_connectomics",
      "status": "finding"
    },
    {
      "criterion_id": "VECTA-DWI-030",
      "criterion_version": "0.1.0",
      "evaluated_at": "<TIMESTAMP>",
      "evaluation_engine_version": "0.1.0",
      "finding_refs": [],
      "input_snapshot": {
        "VECTA.DWI.ACQ.BVAL_COUNT": {
          "state": "observed",
          "value": 7
        },
        "VECTA.DWI.ACQ.BVEC_COUNT": {
          "state": "observed",
          "value": 7
        }
      },
      "profile_id": "dwi_connectomics",
      "status": "satisfied"
    },
    {
      "criterion_id": "VECTA-DWI-031",
      "criterion_version": "0.1.0",
      "evaluated_at": "<TIMESTAMP>",
      "evaluation_engine_version": "0.1.0",
      "finding_refs": [],
      "input_snapshot": {
        "VECTA.DWI.ACQ.BVEC_PLAUSIBILITY": {
          "state": "derived",
          "value": true
        }
      },
      "profile_id": "dwi_connectomics",
      "status": "satisfied"
    },
    {
      "criterion_id": "VECTA-DWI-040",
      "criterion_version": "0.1.0",
      "evaluated_at": "<TIMESTAMP>",
      "evaluation_engine_version": "0.1.0",
      "finding_refs": [],
      "input_snapshot": {
        "VECTA.DWI.BIDS.DWI_PRESENT": {
          "state": "derived",
          "value": true
        }
      },
      "profile_id": "dwi_connectomics",
      "status": "satisfied"
    },
    {
      "criterion_id": "VECTA-DWI-050",
      "criterion_version": "0.1.0",
      "evaluated_at": "<TIMESTAMP>",
      "evaluation_engine_version": "0.1.0",
      "finding_refs": [],
      "input_snapshot": {},
      "profile_id": "dwi_connectomics",
      "status": "unknown"
    },
    {
      "criterion_id": "VECTA-DWI-060",
      "criterion_version": "0.1.0",
      "evaluated_at": "<TIMESTAMP>",
      "evaluation_engine_version": "0.1.0",
      "finding_refs": [],
      "input_snapshot": {},
      "profile_id": "dwi_connectomics",
      "status": "unknown"
    }
  ],
  "derived_metrics": {},
  "evidence": [
    {
      "collector_id": "bids_collector",
      "collector_version": "0.1.0",
      "evidence_id": "ev-00001",
      "privacy_status": "safe",
      "raw_value": "Siemens",
      "source_field": "Manufacturer",
      "source_hash": "<HASH>",
      "source_locator": "<FIXTURE_ROOT>/sub-001/ses-01/dwi/sub-001_ses-01_dwi.json",
      "source_type": "bids_json",
      "timestamp": "<TIMESTAMP>"
    },
    {
      "collector_id": "bids_collector",
      "collector_version": "0.1.0",
      "evidence_id": "ev-00002",
      "privacy_status": "safe",
      "raw_value": "Prisma",
      "source_field": "ManufacturersModelName",
      "source_hash": "<HASH>",
      "source_locator": "<FIXTURE_ROOT>/sub-001/ses-01/dwi/sub-001_ses-01_dwi.json",
      "source_type": "bids_json",
      "timestamp": "<TIMESTAMP>"
    },
    {
      "collector_id": "bids_collector",
      "collector_version": "0.1.0",
      "evidence_id": "ev-00003",
      "privacy_status": "safe",
      "raw_value": 3.0,
      "source_field": "MagneticFieldStrength",
      "source_hash": "<HASH>",
      "source_locator": "<FIXTURE_ROOT>/sub-001/ses-01/dwi/sub-001_ses-01_dwi.json",
      "source_type": "bids_json",
      "timestamp": "<TIMESTAMP>"
    },
    {
      "collector_id": "bids_collector",
      "collector_version": "0.1.0",
      "evidence_id": "ev-00004",
      "privacy_status": "safe",
      "raw_value": 8.4,
      "source_field": "RepetitionTime",
      "source_hash": "<HASH>",
      "source_locator": "<FIXTURE_ROOT>/sub-001/ses-01/dwi/sub-001_ses-01_dwi.json",
      "source_type": "bids_json",
      "timestamp": "<TIMESTAMP>"
    },
    {
      "collector_id": "bids_collector",
      "collector_version": "0.1.0",
      "evidence_id": "ev-00005",
      "privacy_status": "safe",
      "raw_value": 0.081,
      "source_field": "EchoTime",
      "source_hash": "<HASH>",
      "source_locator": "<FIXTURE_ROOT>/sub-001/ses-01/dwi/sub-001_ses-01_dwi.json",
      "source_type": "bids_json",
      "timestamp": "<TIMESTAMP>"
    },
    {
      "collector_id": "bids_collector",
      "collector_version": "0.1.0",
      "evidence_id": "ev-00006",
      "privacy_status": "safe",
      "source_field": "nifti_header",
      "source_hash": "<HASH>",
      "source_locator": "<FIXTURE_ROOT>/sub-001/ses-01/dwi/sub-001_ses-01_dwi.nii.gz",
      "source_type": "nifti_header",
      "timestamp": "<TIMESTAMP>"
    },
    {
      "collector_id": "bids_collector",
      "collector_version": "0.1.0",
      "evidence_id": "ev-00007",
      "privacy_status": "safe",
      "source_field": "bval",
      "source_hash": "<HASH>",
      "source_locator": "<FIXTURE_ROOT>/sub-001/ses-01/dwi/sub-001_ses-01_dwi.bval",
      "source_type": "bval",
      "timestamp": "<TIMESTAMP>"
    },
    {
      "collector_id": "bids_collector",
      "collector_version": "0.1.0",
      "evidence_id": "ev-00008",
      "privacy_status": "safe",
      "source_field": "bvec",
      "source_hash": "<HASH>",
      "source_locator": "<FIXTURE_ROOT>/sub-001/ses-01/dwi/sub-001_ses-01_dwi.bvec",
      "source_type": "bvec",
      "timestamp": "<TIMESTAMP>"
    }
  ],
  "findings": [
    {
      "affected_profile": "dwi_connectomics",
      "category": "evidence_insufficiency",
      "confidence": "high",
      "criterion_id": "VECTA-DWI-001",
      "criterion_version": "0.1.0",
      "empirical_status": {
        "state": "not_tested"
      },
      "evidence_refs": [
        "EV-DWI-PE-002"
      ],
      "finding_id": "finding-0001",
      "label": "Phase-encoding direction cannot be determined",
      "lifecycle_origin": "L3_METADATA",
      "metric_refs": [],
      "observed_condition": {
        "pe_direction_state": "unknown"
      },
      "potential_effects": [
        {
          "causal_claim": false,
          "effect_id": "distortion_correction_configuration_ambiguous",
          "evidence_refs": [
            "EV-DWI-PE-002"
          ],
          "relation": "plausible",
          "wording": "Selected distortion-correction strategy may be ambiguous or\nrequire manual configuration in the absence of a documented\nPE direction.\n"
        },
        {
          "causal_claim": false,
          "effect_id": "manual_intervention_required",
          "evidence_refs": [
            "EV-DWI-PE-002"
          ],
          "relation": "plausible",
          "wording": "The pipeline is likely to require case-specific human review\nto select or approve a distortion-correction path.\n"
        }
      ],
      "recommended_actions": [
        {
          "action_class": "re_export",
          "action_id": "recover_pe_from_source",
          "automated": false,
          "changes_source_data": false,
          "requires_human_approval": true,
          "text": "Attempt to recover PhaseEncodingDirection from source DICOM\nor scanner protocol documentation, then regenerate the BIDS\nsidecar.\n"
        },
        {
          "action_class": "document",
          "action_id": "document_pe_absence",
          "automated": false,
          "changes_source_data": false,
          "requires_human_approval": true,
          "text": "If PhaseEncodingDirection cannot be recovered, document the\nlimitation in the study's analysis notes.\n"
        }
      ],
      "reference_condition": {
        "essential_metadata": [
          "phase_encoding_direction"
        ],
        "profile": "dwi_connectomics"
      },
      "severity": "major",
      "severity_basis": [
        "pipeline_requirement"
      ],
      "severity_status": "provisional",
      "spec_version": "0.1.0",
      "variable_refs": [
        "VECTA.DWI.ACQ.PE_DIRECTION"
      ]
    },
    {
      "affected_profile": "dwi_connectomics",
      "category": "metadata_integrity",
      "confidence": "high",
      "criterion_id": "VECTA-DWI-021",
      "criterion_version": "0.1.0",
      "empirical_status": {
        "state": "not_tested"
      },
      "evidence_refs": [
        "EV-DWI-META-001"
      ],
      "finding_id": "finding-0002",
      "label": "One or more essential metadata items are missing or unknown",
      "lifecycle_origin": "L3_METADATA",
      "metric_refs": [],
      "observed_condition": {
        "essential_metadata_missing_or_unknown": true
      },
      "potential_effects": [